{
  "request_id": "example-demo-day1",
  "action": "infer",
  "stage": "stage2",
  "status": "validated",
  "resolved_inputs": {
    "tmin": "daymet/data/Daymet_ERA5_tmin_dy_1990_0p25deg.nc",
    "tmax": "daymet/data/Daymet_ERA5_tmax_dy_1990_0p25deg.nc",
    "prcp": "daymet/data/Daymet_ERA5_prcp_dy_1990_0p25deg.nc"
  },
  "manifests": [
    "daymet/prepared/manifest.json"
  ],
  "checkpoints": [
    "checkpoints/refine_6x.pt"
  ],
  "commands": [],
  "warnings": [
    "Illustrative result only; no inference has been executed."
  ],
  "errors": []
}
